C_CUSTKEY,C_NAME,C_ADDRESS,C_NATIONKEY,C_PHONE,C_ACCTBAL,C_MKTSEGMENT,C_COMMENT
678,Customer#000000678,"BiQyhSp oiDp,,MFVxyrOwMT810qiQlISEPye",9,195087354910,6303,AUTOMOBILE,gainst the carefully pending requests-- furiously special requests haggle? not
679,Customer#000000679,"IJf1FlZL9I9m,rvofcoKy5pRUOjUQV",10,201466969508,1394,AUTOMOBILE,ely pending frays boost carefully
680,Customer#000000680,TuONtFVII8TR2QtJyl1lS5f0iagaWWsBm1IQo,12,225936632200,4366,AUTOMOBILE,kages: final deposits believe unusual deposits: b
681,Customer#000000681,"x85ncT W41KEcUQCtxE,LD iMNO6j4Hh4x",20,308098785822,236,MACHINERY,ate carefully. accounts hang carefully along the blithely final theodolites. bravely sile
682,Customer#000000682,y5J0HJVI6Mb k4rXTAPbxE9aw,15,252339247389,7421,AUTOMOBILE,"he bold, even accounts breach"
683,Customer#000000683,"G0, q8c6vBykpiLvcuSJLYvqE",6,165662515446,9121,MACHINERY,somas use-- slyly express foxes wake quickly blithely iro
684,Customer#000000684,"5kSJ3qMS,7YKdfmwBFzQN4y8EgPiH,8ln19",15,254562866398,8546,HOUSEHOLD,of the bold requests. blithely regular accounts nag alongside of the carefully silent dolphins. carefully
685,Customer#000000685,eRvmYOdl5v,17,272692249902,2040,MACHINERY,nusual ideas. pending packages use carefully. slyly special sentiments cajole after the blithely even accounts. blit
686,Customer#000000686,1j C80VWHe ITCVCV,6,166822933599,5503,HOUSEHOLD,even deposits print quickly. foxes wake. furiously ironic asymptotes across the bold foxes
687,Customer#000000687,UJTC3 WtzvoD39r1GuoCP,21,311491191456,4999,FURNITURE,special packages haggle carefully slyly ironic pinto beans. sl
688,Customer#000000688,"2QBxK8WIryWMZTsDM JS7GxWCB6Y71Swa,f1EUxk",8,182105462836,3354,HOUSEHOLD,"use alongside of the ironic, pending foxes. final packages use. ironic, unusual dependencies haggle"
689,Customer#000000689,"Gcie9Q,Wc6J0QvKcefqflajjOtOVchnxqBn9",24,343251463591,1481,MACHINERY,ions. furiously unusual platelets cajole blithely. caref
690,Customer#000000690,"xH61m,Si5X4REvi",3,134897605455,103,HOUSEHOLD,"nt deposits. final, unusual requests use blithely. slyly unusual packages against the carefully bol"
691,Customer#000000691,0RkDX6OLU1hISYCLmdLD C,16,267416884189,9566,MACHINERY,"p. ironic, regular foxes against the ironic, special theodolites nod carefully quietly unusu"
692,Customer#000000692,"d6XE9sg,  wINvIz8aZS b8n XuhAQU5",19,298044211703,277,AUTOMOBILE,cuses. slyly even asymptotes doubt quickly. fluffily thin theodolites boost. ca
693,Customer#000000693,r5gn5SUW0tsfkOw42x84,1,113918708153,6577,AUTOMOBILE,"onic packages. carefully final sauternes across the even, express deposits h"
694,Customer#000000694,"3ToF2HqyF9mEcP1QgW NMN,6,KsFq6x4u14MS",10,206463751939,2223,BUILDING,efully final requests detect blithely. furiously ironic p
695,Customer#000000695,"fbT9dQCc,su7JboB5FWI6",8,181311517466,9127,FURNITURE,ly express deposits according to the fina
696,Customer#000000696,dYyj4azN0EE GqeZxv,22,329239165643,3779,HOUSEHOLD,ironic ideas among the carefully bold foxes na
697,Customer#000000697,LFwdGCTUYDenZGoA9,4,146136512263,8122,AUTOMOBILE,he regular pinto beans. courts cajole carefully according to the blithely even theodolites. quickly
698,Customer#000000698,FLZ2NG5pKHpPtAh,23,332821786799,2894,BUILDING,sauternes. gifts cajole. slyly pending platelets cajole at the iron
699,Customer#000000699,"4R6pspbuk5Sp,036VraUEKPBzs",4,148651408680,0,HOUSEHOLD,. finally even ideas wake slyly pending dolphins. slyly even instructions wake whithout the p
700,Customer#000000700,"zyWvi,SGc,tXTls",0,103511197514,4368,MACHINERY,bold excuses. furiously even asymptotes across the carefully regular dugouts cajole fur
701,Customer#000000701,yQU8LcjocNHkk1hse30M0U1f46MrU6dB,2,123237845793,149,FURNITURE,c packages. blithely final instructions according to the regular pinto beans
702,Customer#000000702,BDKtDAva8rBuCWXT6jXb2JJY7YoRS,3,135492965659,4782,FURNITURE,"silent accounts. regular, regul"
703,Customer#000000703,ge1GEYt4ewGUiSeqBA4rNB5JhyQ92uKF,6,167415136919,3998,AUTOMOBILE,arefully final accounts cajole quickly blith
704,Customer#000000704,41s9yU0ossOKgBvjPPSTZqhfciy,9,199988861551,441,AUTOMOBILE,"ously ironic instructions believe about the pending, regular deposits; final accounts cajole alongside of t"
705,Customer#000000705,YKdZRFEGcclF6rmdoiNCY8,18,289914057914,3199,BUILDING,"s pinto beans sleep busily. ironic, bold theo"
706,Customer#000000706,ycxysGDuWHN98FS4lZ2obT9ZPNRWjJTsHbQXvi,19,294682756045,6496,AUTOMOBILE,ses cajole furiously after the ironic requests. pinto beans sleep busi
707,Customer#000000707,DT0nzkijELHyI,21,317969034461,2620,FURNITURE,the deposits. fluffily ironic pinto beans wake quickly. slyly even foxes sleep slyly quickly final deposits. ev
708,Customer#000000708,9iJJ868sXAdFgZyo0V8cfPRTRaUc3d,17,277964906026,2297,BUILDING,p along the carefully ironic pinto beans. even pinto beans are fluffily against the furiously quick dolphins. s
709,Customer#000000709,drDnC6YXTJgcdfJkpbhrQ7z7XmCsoym2t22jwg,18,281178125493,0,BUILDING,g the blithely ironic multipliers sleep a
710,Customer#000000710,"OCLSZuXw1AEK NLvlofMkuK,YNe,bJD40a",22,324594279559,7412,FURNITURE,"ges integrate express, even ideas"
711,Customer#000000711,"EmACeG3r2Y9bxf7KLLgX,ZdQlATjGaafINO",15,253067253622,9592,MACHINERY,"ackages promise. theodolites haggle along the express dolphins. special, special deposits affix slyly final pac"
712,Customer#000000712,8w2pIiA4wWAhtjAdXR,6,168434865087,8667,BUILDING,express dependencies use fluffily final platelets. furiously regular accounts wake furiously. carefully careful cou
713,Customer#000000713,ov fZJgESFHP P,10,205958323185,3829,MACHINERY,"lites sleep slyly furiously express requests. even, even notornis affix furious, ironic p"
714,Customer#000000714,"2,ARep1aMyhgNZqrkc,toQ3XY6FOiCZqNW",9,192097824244,2438,BUILDING,cross the bold pains. bold instructions haggle. even accounts wake slowly. carefully busy ideas need to x-ray sly
715,Customer#000000715,9qLvF42uxUarKl4I 2pEKOMNJmo8Ro5EK,19,295004086392,85,AUTOMOBILE,hins boost quickly. quickly regular epitaphs haggle fluffily quickly bold pinto beans. regular
716,Customer#000000716,"jbXpMEcV9j,6ciftBXEMXDjE",12,225018496084,8365,AUTOMOBILE,as. even accounts about the slyly pending excuses lose bl
717,Customer#000000717,TqWi1c aNhdExPcDD7KQ18W,12,226605188009,8511,MACHINERY,ns poach slyly. carefully express pinto beans ab
718,Customer#000000718,"w,GXCSSI4NEHAFPKG",20,306056358197,8438,HOUSEHOLD,"regular packages-- pinto beans detect ironically. furiously even accounts detect unusual, pendin"
719,Customer#000000719,wry Gj3xd8QX ylUCulG,15,254986997824,0,HOUSEHOLD,gly express pinto beans sleep furiously around the quick foxes.
720,Customer#000000720,"8shFEL7J9sq1NJXR8dixBqaTO,kbSx",22,325758384260,5357,HOUSEHOLD,furiously above the furiously ironic c
721,Customer#000000721,N6hr4gV9EkPBuE3Ayu,21,311745522949,3421,AUTOMOBILE,ar instructions. packages haggle stealthily ironic deposits. even platelets detect quickly. even sheaves along
722,Customer#000000722,aymiuXFyrALTRIzfbLDvtaj37ydq,20,306331099587,2725,BUILDING,leep sometimes express accounts. regular theodolites wake quickly ab
723,Customer#000000723,5tKvCvmVB0yxyAF,21,315421782520,739,BUILDING,e quickly against the blithely final requests. regular pinto beans nag fluffily fur
724,Customer#000000724,dF80enl1y5MfccEMqYz0JSY,5,153166384703,3035,AUTOMOBILE,s. bold accounts about the carefully final packages detect slyly pending platele
725,Customer#000000725,"fm8t3X05Wm,PQxPSPHZy,rHI,wUBLTFO5S",16,269233173870,5030,FURNITURE,"ts. accounts after the even pinto beans boost across the ironic, silent accounts. reques"
726,Customer#000000726,"4w7DOLtN9Hy,xzZMR",3,131682337513,6254,BUILDING,"wake after the regular, final instructions. final epitaphs mold fluffily blithely ironic id"
727,Customer#000000727,wLIX8hKnk0qjUAAGqm,18,288153163525,807,FURNITURE,requests-- quickly regular pinto beans need to detect
728,Customer#000000728,"uACufK5vIMlsq,v9d4U5ZWi,",24,341953841105,4350,BUILDING,re stealthily furiously bold requests. carefully final pinto beans lose slyly
729,Customer#000000729,"YZxBLBAqBmW53g2ia6s4u,MlJ4WhW",20,309005722883,8947,MACHINERY,packages about the furiously even foxes sleep furiously furiously pending ideas. slyly ironic epitaphs
730,Customer#000000730,ORP6ofUwyD1,2,125139732702,4718,AUTOMOBILE,foxes would cajole furiously slyly special forges; slyly regular pinto beans inste
731,Customer#000000731,D0ceqTVRO3EctrC,7,177319159753,9311,MACHINERY,"lar dolphins are carefully slyly final theodolites. unusual accounts integrate across the regular, final deposit"
732,Customer#000000732,"tQ,r4voHok7oeKw9msDh4ORGje",16,261542852634,4831,BUILDING,structions are after the even deposits
733,Customer#000000733,Ks7Ed2g7zDP905tLGdGcFtomDNchNdaPK2cd,13,231109486754,4351,HOUSEHOLD,"furiously. pending, quiet packages nag slyly. stealthy pinto beans haggle"
734,Customer#000000734,xULRxhbfzPT5nBh,18,288801755173,9751,AUTOMOBILE,"tions against the ideas haggle furiously quickly regular forges. carefully final requests solve even,"
735,Customer#000000735,"8Gn WOTY4cgGaoHwezrZ,JN,Px8e sr",5,159595764327,294,BUILDING,ites. furiously unusual frets boost among the slyly ironic theodolites. packages cajole
736,Customer#000000736,zQNs5e2aFcVY8MigFQEBtoCaQ9e,1,116177262039,9115,MACHINERY,the deposits. blithely regular asymptotes boost q
737,Customer#000000737,NdjG1k243iCLSoy1lYqMIrpvuH1Uf75,18,286589381102,2502,AUTOMOBILE,ding to the final platelets. regular packages against the carefully final ideas hag
738,Customer#000000738,iecb89zRRNeN3KywZSaPXEWMjz,10,207223705220,2735,MACHINERY,carefully slow instructions. furiously express dependencies alongside of the ca
739,Customer#000000739,pAROUfTi3wCEHi1PXu,14,243093026776,6344,HOUSEHOLD,ly regular accounts. blithely final theodolites sleep blithely. furiously regular decoys cajole blithely. bold de
740,Customer#000000740,FCerGpsfsWAsBrQTyqdzMxUQnbQembHKGg,10,202151563727,1734,BUILDING,"ets. final, blithe theodolites abou"
741,Customer#000000741,jiPAOQuJ5gIauMfvcbE8lKUVPMp,12,225608542068,9195,HOUSEHOLD,ve the fluffily regular accounts wake carefully ironic grouches. slyly bold theodo
742,Customer#000000742,2qRObRkFktME6SsNV0Pa3L8txbA0AFtXuWsKrkW,12,226105828610,6381,HOUSEHOLD,eodolites alongside of the daringly ironic deposi
743,Customer#000000743,WJ  lVLsFSgZJCHHLqwRmvCjWvYlCs0c2TvO,20,307435597934,8450,HOUSEHOLD,ptotes. furiously even accounts haggle slyly. ironic foxes sl
744,Customer#000000744,nYSoGuQkf,7,171215554268,2459,HOUSEHOLD,"n packages. furiously silent foxes sleep regular, regular accounts. slyly ironic patterns cajole fluffily"
745,Customer#000000745,vjuHvDKdaomsivy l,18,289134389403,7115,FURNITURE,"o beans. bold, regular theodolites haggle carefully about the quickl"
746,Customer#000000746,"JOKj8N2QKUm8Gi,F4qX0fLVy",20,301543549928,1164,MACHINERY,final theodolites. final pinto beans haggle-- furiously
747,Customer#000000747,uuichgTY7NjlZaaRZ6S7KzvapZWvAiCUWAQr,8,187935042931,68,FURNITURE,eodolites. blithely regular pinto bea
748,Customer#000000748,1 nkl3GMSnweulTNAMPeB8Sa5aSIk,23,334032262580,6959,AUTOMOBILE,nts. special excuses thrash blithe
749,Customer#000000749,U1Dvu0r793a,24,341586979591,7491,MACHINERY,"accounts was. final, final requests wake. theodolites was slyly. blithely even foxes wake carefully ac"
750,Customer#000000750,5OyNRajjgjjbaXtI rkxvB2lX4c6u,8,182355871274,270,BUILDING,"s. regular, regular deposits sleep carefully blithely bol"
751,Customer#000000751,e OSrreG6sx7l1t3wAg8u11DWk D 9,0,106585502257,2131,FURNITURE,ges sleep furiously bold deposits. furiously regular requests cajole slyly. unusual accounts nag unusual ide
752,Customer#000000752,KtdEacPUecPdPLt99kwZrnH9oIxUxpw,8,189249936038,8364,MACHINERY,"mong the ironic, final waters. regular deposits above the fluffily ironic instructions"
753,Customer#000000753,9k2PLlDRbMq4oSvW5Hh7Ak5iRDH,17,278171263646,8114,HOUSEHOLD,"cies. deposits snooze. final, regular excuses wake furiously about the furiously final foxes. dependencies"
754,Customer#000000754,8r5wwhhlL9MkAxOhRK,0,106465955871,0,BUILDING,er regular accounts against the furiously unusual somas sleep carefull
755,Customer#000000755,F2YYbRT2EV,16,263952472207,7632,HOUSEHOLD,xpress instructions breach; pending request
756,Customer#000000756,Lv7cG by4Wyd8Hzmumwp8hSIZg9,14,242672987503,8117,AUTOMOBILE,"ly unusual deposits. fluffily express deposits nag blithely above the silent, even instructions. expr"
757,Customer#000000757,VFnouow3LhLvEDy,3,137044082991,9335,AUTOMOBILE,riously furiously unusual asymptotes. slyly
758,Customer#000000758,8fJLXfS5Zup0GQ3xBKL3eAC Q,17,271757999168,6352,HOUSEHOLD,eposits. blithely unusual deposits affix care
759,Customer#000000759,"IX1uj4NFhOmu0V xDtiYzHVzWfi8bl,5EHtJ",1,117318061019,3478,FURNITURE,"above the quickly pending requests nag final, ex"
760,Customer#000000760,jp8DYJ7GPQSDQC,2,121761163113,2883,BUILDING,uriously alongside of the ironic deposits. slyly thin pinto beans a
761,Customer#000000761,oObRVLlulGS5xikRk8La,19,298356314258,1526,BUILDING,ress Tiresias haggle across the never ironic ideas. blithely pending theodolites cajole ironically
762,Customer#000000762,"n5QsjD,gTSrdNRoRpvWqS",11,217574557898,3765,FURNITURE,sublate carefully carefully regular deposits. bold foxes along the gifts nag
763,Customer#000000763,ACMrkbcf3a2J3aobVEmU5hGnHuc,1,112327193610,2650,BUILDING,ironic asymptotes are. slyly bold realms alongside of the fluffily specia
764,Customer#000000764,F8WBznjtO2bX2knXl4ghnsp ixWylkf,16,267143224800,2061,MACHINERY,tructions. quick theodolites kindle
765,Customer#000000765,b7w2edOUZNe0QX 3Ab3y5RFlMZX,20,305446577473,5683,AUTOMOBILE,ter the blithely regular foxes. slyly bold packages use bl
766,Customer#000000766,zGTH6uWKoQxIE,16,262838478946,4678,BUILDING,ly special deposits boost blithely above the slyly ruthless ideas. carefully bold asymptotes unwind about the e
767,Customer#000000767,"9f3 XsYXdvP0E39ZBi7r7oRCns3PTx,H",17,275261433959,7647,BUILDING,ngly express dolphins boost carefu
768,Customer#000000768,",cIZ,06Kg",18,288514938588,9619,BUILDING,to cajole blithely express asymptotes. foxes use quickly. carefully special ideas could have to are bravely bl
769,Customer#000000769,0eGzsjpDFsN0,5,151026354835,5951,HOUSEHOLD,ggle slyly pinto beans. furiously even excuses above the
770,Customer#000000770,IjwJR6TjBJZbKIeouH2d,8,188561125677,2067,AUTOMOBILE,"dolites haggle express, express requests. furiou"
771,Customer#000000771,"J9UMiYJznHVHZDuCG,ErV0iiMStETS",23,337613714753,7462,AUTOMOBILE,"arefully unusual accounts shall boost unusual pinto beans. ironic, final ideas boost. slyly i"
772,Customer#000000772,TBxlR0AAHeSYl0vyK 8joF,20,304056144887,7555,MACHINERY,"ular requests. final ideas sleep. regular, even platelets could haggle blithely bol"
773,Customer#000000773,NyRSeog kIkD7YOb0EuSfSGxfptN5nkX26Mk6,8,184563773723,4578,FURNITURE,hely silent ideas could doubt carefully al
774,Customer#000000774,95 O8gd08tdtmJwM0ebHUnDc,11,214636526686,0,HOUSEHOLD,nd the bold platelets affix furiously doggedly express accounts. carefully unusual deposits serve furiousl
775,Customer#000000775,Cg3M4gTXeIY7llMN2puop7D2,17,279039367924,1377,BUILDING,"ts. blithely regular requests upon the ironic, final courts haggle sly, regular deposits. final requests"
776,Customer#000000776,"rzhIStRHsiWoc6K,7yv3YMqVdrz",15,259416508313,2669,AUTOMOBILE,express accounts. furiously ironic theodolites serve blithely. blithely thin packages are among the eve
777,Customer#000000777,27adTXaVp7araW,20,307651639750,9098,AUTOMOBILE,pinto beans; furiously special platelets haggle quickly against the slyly unusual foxes.
778,Customer#000000778,tCuRA2W9y5iiGrcT7a4TzK,23,337021793134,52,MACHINERY,"hely ironic instructions. regular, ironic requests affix along the carefully"
779,Customer#000000779,"2cTZiS4ulZ74edT,RmDnh4ZaCrphMMh Ff2",5,159404835702,0,HOUSEHOLD,old dependencies. pains haggle fluffily carefull
780,Customer#000000780,CMxcdzgEUkCWP1,8,188445767345,9874,FURNITURE,", final packages use slyly regular deposits. slyly ironic instructions nag careful"
781,Customer#000000781,"FQCAkyfV0 kL3,FNA1OlBjABak",18,284783885881,6404,MACHINERY,ake blithely blithely final foxes. blithely silent pinto beans haggle furiously. fluffily bold acco
782,Customer#000000782,HFuyemzqz0g QhkL,19,298505767450,0,AUTOMOBILE,usly bold deposits-- furiously ironic accoun
783,Customer#000000783,01bR7OOM6zPqo29DpAq,1,119202568525,2436,FURNITURE,slyly carefully pending packages; doggedly bold theodolites boost slyly slyly dogged excuses: slyly expr
784,Customer#000000784,"evcGXqbosO6,qhx",14,249755742063,3170,BUILDING,cajole quickly. ironic dependencies wake quickly. silent ideas use furiously
785,Customer#000000785,gEkI8kSq8RYgO6tiTA0AB7urZX8s2w03JGwtMi9,18,288086702983,108,BUILDING,"nal theodolites. dogged, ironic deposits wake carefully. slyly regular requests after the furiously ironic"
786,Customer#000000786,"viZtkiJ gbMcPrINM3Ez,33vOJW",13,234133652022,400,MACHINERY,ccording to the regular deposits. carefully final packages run. slyly final deposits h
787,Customer#000000787,wwPe2vMZZ1n1Mm2z0qzDfS43FPj2Ndn,10,202106173870,212,AUTOMOBILE,e. ironic theodolites serve regular foxes. pending requests haggle slyly busy instruct
788,Customer#000000788,LbFHoDpNUSu3AyDS7KLgjoQBJV,16,263886899272,0,FURNITURE,. unusual packages against the
789,Customer#000000789,DW0NMV Ci5V2bnsX0Al98plG1J0QZqNwcjEVW,9,191765174263,6039,BUILDING,as. quickly special courts integrate slowly final accounts. ironic packages are slyly about th
790,Customer#000000790,CR bzmYYVP,0,103688329671,2725,BUILDING,riously final requests haggle to the blithely special requests. blithely pending gifts after the carefully silent id
791,Customer#000000791,3ZWQ5xexnnLDEmxpmbg,13,235757754059,3695,HOUSEHOLD,posits cajole carefully along the slyly final packages
792,Customer#000000792,"icVt7HjGs,p3YL3nr1MHgaQIY5Gmzej57nB,b",7,173925004370,1672,AUTOMOBILE,latelets along the carefully even packages cajole blithely packages-- even pinto beans haggle
793,Customer#000000793,"SltK1IMp2Xvwb,A0x3Co1uhcwr",0,104049539048,2073,BUILDING,uickly silent foxes use after the
794,Customer#000000794,RMY8 LyGnJ67NGc5cxPYiIDSF,23,336334705945,1710,FURNITURE,gular patterns cajole slyly blithely final ideas? furiously unusual courts wake among
795,Customer#000000795,droXvSIcNEElsEYS,14,249739906608,8443,HOUSEHOLD,packages cajole furiously since the slyly
796,Customer#000000796,79bj5Rk3jJj9ked7M,3,135544116773,2584,HOUSEHOLD,re slyly even deposits. pending pac
797,Customer#000000797,bdGkzA5duas6LZ1ywB96K6Av3x 99q95h,0,109946097082,3063,HOUSEHOLD,"iously regular packages mold fluffily. express, idle accounts nag furiously across the carefully ironic req"
798,Customer#000000798,wW2OgnHj6dBz tO9OXFqCLm,4,146704237529,0,HOUSEHOLD,"sleep slyly ironic, express ideas. slyly special packag"
799,Customer#000000799,LVk8ljWeIYTQQFMKCmxEeRpWQT,12,229096937833,2263,MACHINERY,ets haggle. busily final packages nag carefully after the bo
800,Customer#000000800,"mpI6pkdnWLZsBbQi4,uUC5Y3TcM9vmRIgZelrQ",14,245556302261,9443,AUTOMOBILE,ly alongside of the carefully ironic deposits. blithely ironic packages are blithely agains
801,Customer#000000801,UQ67hfDJlxgX68hiFPmDuHav12Vx,16,264394958236,5207,FURNITURE,sits wake blithely according to the slyly un
802,Customer#000000802,ZDk4Suvi8gMp2LLAOW6nFA 3u,0,106062365778,1378,BUILDING,the carefully even pinto beans. carefully unusual pinto beans against the asymptotes cajol
803,Customer#000000803,zm7Xs6RJJJfZ,18,288554299109,6003,BUILDING,. blithely special instructions
804,Customer#000000804,"u6xYwCLD,Vd4ODt8",24,348617604796,3,AUTOMOBILE,usly. final accounts integrate slyly above the furiously sly pinto beans. furiously unusual ideas
805,Customer#000000805,"wCKx5zcHvwpSffyc9qfi9dvqcm9LT,cLAG",10,207329895653,512,BUILDING,busy sentiments. pending packages haggle among the express requests-- slyly regular excuses above the slyl
806,Customer#000000806,FTM62Dujm2BoblKFY w,12,228888832475,6859,FURNITURE,the carefully regular accounts breach above
807,Customer#000000807,zKjtrn5FGIs,17,273337795333,1930,MACHINERY,y final patterns? carefully pendi
808,Customer#000000808,S2WkSKCGtnbhcFOp6MWcuB3rzFlFemVNrg,19,295313197726,5562,BUILDING,unusual deposits. furiously even packages against the furiously even ac
809,Customer#000000809,eApaa5hW3Mqp11ZuOP,16,267762235427,0,HOUSEHOLD,ackages. quickly unusual dugouts c
810,Customer#000000810,3J1wwVhwzVT7XM1v3Rzx90a8c4,9,199979292765,9633,FURNITURE,ep pending deposits. quickly bold accounts are carefully instructions. ruth
811,Customer#000000811,Rau3ADOLCNXM42D6fjQTFuueQce2BHw9r,15,255757312159,9010,BUILDING,kly pending foxes dazzle fluffily after the furiously bold packages. fluffy
812,Customer#000000812,"u9uI3BE68quHja6k0,UXRYFgvLHl3jKhn",17,277146182239,3429,BUILDING,ar packages. packages thrash amo
813,Customer#000000813,VBNrCYm67O,9,195851731514,5673,HOUSEHOLD,ts cajole silently bold pinto be
814,Customer#000000814,KmMC1nd5iOXTRlhzMu13Wtx,15,253422693824,4011,BUILDING,yly at the blithely regular excuses. carefully thin pinto beans boost slyly furiously regu
815,Customer#000000815,TmpTFwt3b0 WQUmljE1LKbg50dtQszn67qEog,12,229416067227,5841,HOUSEHOLD,"unusual accounts. slyly ironic pinto beans nag against the regular, regular requests. slyly p"
816,Customer#000000816,k2dnnQZowe,24,344579107430,9239,BUILDING,accounts cajole slyly quickly express platelets. carefully silent theodolites wake carefully. pe
817,Customer#000000817,"jDJt0Wfk0,Wcx5HOI5itS XqUJmMpjzJ",0,105663414382,7298,MACHINERY,y against the carefully special patterns. unusual accounts sleep quickly final instructions.
818,Customer#000000818,CvQvKClYoh9lPjMngrjbCoxqqnp2QFiTe8eF,20,309431415174,0,BUILDING,"yly. blithely final platelets haggle regular, regular ideas: furiously r"
819,Customer#000000819,"cug3zDy qHUaZMQNEtYlWK3R,mGrid4Of",12,224249901743,2152,MACHINERY,y final accounts sleep slyly express ideas. carefully express foxes sleep. carefully stealthy pin
820,Customer#000000820,xsYy3Nu7RhNYyBqL8dD0fONh,4,149933685047,0,AUTOMOBILE,"g, final ideas. slyly ironic packages dazz"
821,Customer#000000821,PVdTfF7cfPueJS0MBncE5v4bKfPV64Zg,5,159014602033,2691,FURNITURE,wake carefully. slyly express deposits wake furiously among the fluffily final deposits. pa
822,Customer#000000822,"ZoRr18ZiDTtkRduo6PO60gNRg,b46zOe QdS8B",13,234108011644,736,BUILDING,ding dependencies hang alongs
823,Customer#000000823,HuoOuJLxx7S8YDQhexfmIX,0,101094305638,739,AUTOMOBILE,l requests are against the slyly ironic pinto beans. blithely unusual packages wake alongsid
824,Customer#000000824,"qHxq5m g6Ug,SDq7R17",18,284541245859,6840,AUTOMOBILE,ffily unusual packages. furiously final ideas
825,Customer#000000825,"L8P98o,xq9E78kmuadw,Z7Rwy",10,204928631129,1809,HOUSEHOLD,"busy deposits. careful, bold foxes eat furiously according to the final as"
826,Customer#000000826,f5Y UZoE nR,13,237623287631,8938,BUILDING,"usly final dinos. final depths wake slyly across the final, bold requests. bl"
827,Customer#000000827,fmmKD8aBlF9bFndkYf402cHVrUj8FhGZtHeL,14,241963436537,5411,HOUSEHOLD,om the carefully even requests are slowly along the regular
828,Customer#000000828,"0PkG ELwBIgU4AsNcjDc5Q,9Gj",23,331086804317,7060,BUILDING,cial instructions. accounts nod special accounts. slowly even deposits belie
829,Customer#000000829,"4oht3f64ZWA1,ACbBP9DNxjjG1CbIqOCK",8,184047076095,4087,MACHINERY,"deposits cajole slyly ironic, express packages. asymptotes cajole ruthlessly"
830,Customer#000000830,4fNmWCmfys1jUI,23,334085486806,7776,AUTOMOBILE,ironic packages integrate alo
831,Customer#000000831,1DyQwHuUncB7BSnQUiW8ksexb,20,304955915384,3401,AUTOMOBILE,c instructions. fluffily bold requests are furiously quickly ironic deposits. carefully
832,Customer#000000832,eNIy9PatAWlh0,19,292648648387,0,HOUSEHOLD,the special ideas. finally ironic accounts doubt. slyly regular ideas
833,Customer#000000833,"t3qDCo,Yh MZcJFV6PibeY,MUunz",6,166243074875,0,FURNITURE,uickly final orbits across the blithely express accounts integrate furiously among the final sheaves. blithe
834,Customer#000000834,"y4mA, TY6DW4gAY",14,246378037812,0,MACHINERY,regular dolphins. furiously careful ideas eat beyond the bravely regular packages. slyly unusual deposi
835,Customer#000000835,Sjqs42jh111,21,317002426347,2107,BUILDING,"gside of the furiously final packages wake quiet, permanent accounts. unusual packages into the unusual, ironic req"
836,Customer#000000836,rayz3tXswDbL4hyIr5SMrEIOTqvmok48e,12,221813136281,9185,FURNITURE,press deposits-- fluffily express accounts cajole carefully according to the daringly even deposits-- furi
837,Customer#000000837,mMNC8wjT5aC655e3,9,195727308324,2701,BUILDING,"he bold, pending theodolites. special, bold accounts haggle. blithely regular ideas nag fluffily regular packages"
838,Customer#000000838,BxDlz44b56kXjsTpl,5,159191927197,1606,AUTOMOBILE,elets. never express accounts haggle slyly. depths along the requests haggle bl
839,Customer#000000839,Ch8 wZk5UKK45BSq1uZLJL0Z A8UUoms,22,324358257973,2925,HOUSEHOLD,close accounts. unusual pinto beans sleep quickly slyly bold instructions. blithely unusu
840,Customer#000000840,9wA4l70okCEW3GnYQvlIAXetDgD50l,22,328021561748,6799,AUTOMOBILE,usly according to the slyly regular pinto beans. blithely regula
841,Customer#000000841,pSISKRxFIgVasW71fLyaEuODHZQLBfd6E c7jo,9,195566959964,884,FURNITURE,ly. slyly special instructions wake. carefully even accounts sleep quickly slyly silent deposits. s
842,Customer#000000842,stRBRwdFCkdN,0,102721261413,8635,FURNITURE,"silent pinto beans. bold, pending platelets sleep furiously express theodolites. fluffily express reque"
843,Customer#000000843,OEJ7AElvHgEtDpjcrXgLK,14,249795847928,676,HOUSEHOLD,ronic somas. accounts was among the carefully unusual requests. unusual pinto beans are blithely regular depths. s
