C_CUSTKEY,C_NAME,C_ADDRESS,C_NATIONKEY,C_PHONE,C_ACCTBAL,C_MKTSEGMENT,C_COMMENT
1010,Customer#000001010,uasIK CZZ5,5,152214633776,1653,AUTOMOBILE,ing ideas doze carefully accounts. slyly regular theodolites poach. carefully pending de
1011,Customer#000001011,6m8KP FxT4nnHgoc4CN70TVLW1X5Q,5,157368093168,1189,BUILDING,uriously express asymptotes. u
1012,Customer#000001012,5Zsp rqM6oCmgqqFe,4,145355516255,4422,AUTOMOBILE,s above the carefully express r
1013,Customer#000001013,k5rfeOtchP1  w,15,257255991183,0,BUILDING,idle packages cajole regular asymptotes. carefully express forg
1014,Customer#000001014,"ZsiaboMOOV,aGwWUpfE",11,215534259152,0,AUTOMOBILE,"telets. ironic platelets cajole carefully; bold, special instructions unwind blithely regular somas. carefully"
1015,Customer#000001015,RDJWEmcAk4GC8OT8WCsXB,10,201349265391,6392,HOUSEHOLD,g courts nag daringly brave pains. blithely special deposits use blithely carefully c
1016,Customer#000001016,8tzkhPXMFHKgmz,11,216833682994,2358,AUTOMOBILE,ular deposits. special foxes solve quickly idly special ideas. never final asymptotes nag. furiously even deposi
1017,Customer#000001017,OoVPZGR5hUp8oo,16,265939415690,0,MACHINERY,integrate furiously furiously even pinto beans. ironically pending packages cajole quickly furiously special
1018,Customer#000001018,"yldxLZOgQwzrXh3t4yktykZZV8v,vK2c6pVr",18,284507644871,8342,FURNITURE,"e quickly around the quick, regular pinto beans. regular, regul"
1019,Customer#000001019,VMFs38VlBt01g30PzPyliiAoGHazC4HG74JJ,21,315026833413,2115,FURNITURE,quickly special ideas about the courts use of the pending instructions. furiously final accounts c
1020,Customer#000001020,"DHom,LSHKfYSwLSZv39AooYQHlvbaeztefjwR",3,136922868158,6915,MACHINERY,es. blithely unusual asymptotes sleep ironic accounts. fluffily express sheaves haggle fl
1021,Customer#000001021,m h2wQbujQnQOrcf109reW0 o,6,164695545196,1287,MACHINERY,courts could hang quickly express epitaphs. foxes haggle above the carefully unusual requ
1022,Customer#000001022,"lP,9H6e6mQwLsWYYr2Y",8,187335532195,9606,AUTOMOBILE,ending packages. dependencies along the slyly pending dependencies wake carefu
1023,Customer#000001023,"w8 oxHcOTUiF8dOr,ktZ05pO7qcHZ8ZeH7",17,279603065136,7188,AUTOMOBILE,"express requests. slyly ironic asymptotes throughout the ironic, final packages nag careful"
1024,Customer#000001024,9wLrRS78uOPy7CHW,11,215087797822,0,FURNITURE,carefully regular instructions. furiously final deposits across the carefully special ideas cajole furi
1025,Customer#000001025,3T2A1uo8mCqTeO LTW8atjLBLO12nh6lyl,8,185884564616,3363,AUTOMOBILE,to beans sleep according to the fluffily regular instructions.
1026,Customer#000001026,ktKcS9tV2OC8T42KVqMem NjkNO 4pkXmu,17,271692218173,9699,MACHINERY,"totes against the stealthy deposits haggle fluffily after the regular, regular deposi"
1027,Customer#000001027,GNaw4RXXMr,2,122781545262,4946,BUILDING,"final requests haggle. final, even sheaves maintain carefully above the even ac"
1028,Customer#000001028,"NxmOhIN,w45aogQ1hZSvqoz0 8nrbdkaiZOe",10,205821193249,1916,AUTOMOBILE,"ly unusual, even packages. fluffily special foxes across the furiously final asymptotes main"
1029,Customer#000001029,"D3TLK5s,gc",15,256028108723,6252,BUILDING,arefully furiously final pinto beans. daringly express deposits
1030,Customer#000001030,Xpt1BiB5h9o,8,187598771870,6359,HOUSEHOLD,ding to the slyly unusual accounts. even requests among the evenly
1031,Customer#000001031,"dwCYOftUgV5,EwGJc",21,319466411853,2227,AUTOMOBILE,"theodolites. even theodolites sleep slyly. special, express excuses cajole among th"
1032,Customer#000001032,6yoIzDrw5zLBO,18,284492273528,1854,FURNITURE,sleep quickly even somas. permanently regular grouches cajole blithely furiously ironic ide
1033,Customer#000001033,WOozPuOF8UdYMwjF5,8,184703802978,81,BUILDING,to the quickly final packages. carefully slow accounts use blithely slowly permanent requests. un
1034,Customer#000001034,"Fn5qqb64TSKuJWz4f8GpPkF,c3WY3yqjsV,GgHu",5,153701796631,7350,HOUSEHOLD,"bout the ironic requests-- packages wake. requests haggle silent,"
1035,Customer#000001035,"7yTbQ665G3Bi,6BK0EmQPw,Gc7bZOPk4ncXpo",10,203763453729,7499,AUTOMOBILE,ound the fluffily enticing foxes detect slyly at the furiously final deposits. quickly final instru
1036,Customer#000001036,fxujgj8DOFO6oKrH,8,187915777691,1766,BUILDING,ins sleep. slyly express platelets cajol
1037,Customer#000001037,dwgDZPKR5ZuU3HO2sDOS7Ym0oeC8c6Xm,23,338559602989,4936,BUILDING,lly final pinto beans. pending instructions boost careful
1038,Customer#000001038,yQCza56pNgcF9sxDR HCed22GeEq,17,275111011611,0,AUTOMOBILE,uriously express accounts. even pinto beans wake. slyly regular requests according t
1039,Customer#000001039,F602TgKjElSWrZ,10,208718869220,7619,FURNITURE,nding packages use. blithely regular sheaves doze blithely. fluffi
1040,Customer#000001040,vbJmdHe6U9Pl,11,217561091482,2861,BUILDING,old requests wake slyly! slyly special deposits cajole above the unusua
1041,Customer#000001041,189f n2lA4,11,213142903052,7994,MACHINERY,uctions are busily along the furiously ironic instructions. blithely thin waters cajole slyly.
1042,Customer#000001042,S1sh9gyFn21m4zkb4J95GD5,5,152156523459,9850,FURNITURE,ly bold dugouts! pending asymptotes are blithel
1043,Customer#000001043,HJMn12xn4bl vWC7iVuTRsErYEzlyCO,7,172663348613,5848,HOUSEHOLD,iously ironic deposits cajole slyly busily final account
1044,Customer#000001044,Eh2e8gLyStrLE7A,0,104514599620,7291,BUILDING,ly across the slyly ironic accounts. even requests
1045,Customer#000001045,clvGUnQPLbzX 23hemPp24WS1MEtS4z,20,301209922121,2942,HOUSEHOLD,r deposits cajole blithely along the quickly silent pattern
1046,Customer#000001046,umgqzlyUW3AYz2C39YMhIgf,10,208901618958,2311,BUILDING,accounts. carefully regular theodolites run fluffily carefully e
1047,Customer#000001047,"h5iBRMsym,y6LLSQU2DzNftiET qZ",9,191463994251,8919,BUILDING,lar packages haggle theodolites. thinly express deposits
1048,Customer#000001048,Mk0ebiw9SaFBTwoib,19,297576423735,2584,BUILDING,"s are slyly regular foxes. slyly final pinto beans wake quickly among the regular, spe"
1049,Customer#000001049,bZ1OcFhHaIZ5gMiH,9,194992582851,8748,MACHINERY,uriously according to the furiously silent packages
1050,Customer#000001050,KgVnjN7Y4HCN5f97HEUp7kYNNTrE3 O,11,214483134374,0,FURNITURE,ely ironic packages. blithely regular foxes sublate furiously. special requests boost furiously agains
1051,Customer#000001051,"iHS,UFudVOOe",2,128692211428,9776,HOUSEHOLD,cuses boost furiously silent deposits. quickly silent requests integrate quickly bold asymptotes; slyly regular ide
1052,Customer#000001052,"OcXtKS,1Hvf2D0 rPvhw4qXViYOudQ3",13,234964759040,2838,BUILDING,s accounts haggle against the furiously final asymptotes. ironically regular accounts boost. furiously fina
1053,Customer#000001053,wDJTteyausmZswQAFQot,16,264003126496,0,MACHINERY,efully enticing pinto beans. final pack
1054,Customer#000001054,Xgj6QVy2I9FVoSiIbgLf9LIE8XpWI2RtmbGUx,21,319152929727,8844,HOUSEHOLD,y pending ideas. dogged dependenci
1055,Customer#000001055,Z3AggyEMPME2hqqTfbMC76O0z,7,178021317180,640,HOUSEHOLD,dolphins: furiously ironic pinto beans above the carefully regular foxes nag slyly across th
1056,Customer#000001056,8u1rnDOcvU109,5,153252855215,6287,HOUSEHOLD,leep except the foxes. packages eat enticingly along the requests. even
1057,Customer#000001057,"xyV8 FbW4xS,JhkxC0dY527tzcMKxM",24,347507351314,0,AUTOMOBILE,s. furiously ironic deposits against the carefully bold accounts wake carefully even deposits. fluffily even
1058,Customer#000001058,R0NIEcSVDQ4rNUcCevDrap,19,298186209637,6808,MACHINERY,uctions. slyly express pinto beans are furiously. bold theodolites according to the fur
1059,Customer#000001059,"OHwYMiDjmgeIQXhLlNW,8LIwIEr",23,336834189460,1548,HOUSEHOLD,"wake carefully. carefully quick excuses cajole ruthlessly among the ideas. bold, ironic braids are"
1060,Customer#000001060,aWJkU6JJJOvgaKPOAJJc,8,182907946133,2841,HOUSEHOLD,"ter the bold, regular ideas! deposits eat. daringly unusual theodolites sleep alongside of the regular, fina"
1061,Customer#000001061,CqLhg io1CpQKhrVHHDhWg1Omrx1hLcpKB6h,4,149094178324,0,BUILDING,ticing packages maintain doggedly carefully regular instructio
1062,Customer#000001062,3OYrGEJC1YUa9DP,22,322076008684,4710,HOUSEHOLD,ag. carefully regular asymptotes a
1063,Customer#000001063,yHVWD7y1Oe1P,21,312773499036,1663,MACHINERY,ress attainments. furiously regular excu
1064,Customer#000001064,VmFhpV9 aIqPysMHRIWZl,15,253919984106,1666,MACHINERY,gular accounts. thin platelets promise fluffily. carefully express accounts haggle quickly qu
1065,Customer#000001065,qGBa7X0dOMsKLuYBpShpJVwGyU9rh,22,326052262449,4663,HOUSEHOLD,nts. quickly quick dolphins run
1066,Customer#000001066,2Ge 0Nk29FlBs1GuBiY84sLvn38mEkAKnM,0,103334634472,950,MACHINERY,"requests. slyly final instructions sleep. fluffily even packages cajole pending, final"
1067,Customer#000001067,"g25CH,fhra",23,337641239568,9154,FURNITURE,ackages are furiously carefully even dependencies. idly final
1068,Customer#000001068,"ElWdGnnKpmo0sA1Au teWwomSVgG,me",18,284859847299,737,AUTOMOBILE,"nto beans. dinos sleep fluffily carefully regular sentiments. final, special packages wake blithely. ironic"
1069,Customer#000001069,PdWrPGSArhnqWQ km65e,21,319277116278,5465,BUILDING,. ironic excuses after the special hockey pl
1070,Customer#000001070,m0sYmeYs5wLydSS qw542Et32,15,258948439171,3160,FURNITURE,carefully across the express foxes. carefully special accounts ca
1071,Customer#000001071,PgCAYL2LEwE7v7Pk4dYpRe Nn7MN8wVzYbA2qtj,16,263502316183,4034,MACHINERY,ar accounts. quickly regular packages sleep bold ideas. slyly pending asymptotes a
1072,Customer#000001072,HpCr1tM88WoELSld708ByJ,4,144328826163,7979,HOUSEHOLD,ic pinto beans are blithely across the grouches. furiously pending platelets sleep pe
1073,Customer#000001073,KEyFI2gYMZrSVbMMMIf,10,207741976595,8217,BUILDING,fter the blithely regular pinto beans. express asymptotes sleep special pa
1074,Customer#000001074,"nG,eR,gjPr",10,201768391649,123,BUILDING,ly final courts haggle quickly boldly express excuses. dependencies eat. slyly even requests boost blithely
1075,Customer#000001075,"hTIc2AUg pqhYh2W0yMUTQtrZV1KUutysIb6,nxb",21,317242344181,2715,BUILDING,regular patterns. unusual platelets try to are unusual theod
1076,Customer#000001076,C1gf0FyiU H88P0cpv4UOcdgaPRpVA,10,204057101902,3509,AUTOMOBILE,"ainst the silent, silent ideas. sly theodolites use carefully express accounts. regular foxes boost carefully agai"
1077,Customer#000001077,sjk1DTHWVMX53kG8AbTtTh1EcMvWeDO8gFDdpQOK,21,313672944048,8582,AUTOMOBILE,lithely regular deposits. carefully pending deposits sleep. quickl
1078,Customer#000001078,"ZjRzAz8QbEeIkJxrUI,b",19,297296926790,71,MACHINERY,"onic requests wake slyly furiously final attainments. ironic, even accounts cajo"
1079,Customer#000001079,cOyd7wsHIQq2LNN,19,296999302250,2136,AUTOMOBILE,ter the express foxes nod slyly excuses. slyly speci
1080,Customer#000001080,"Yux,gs14NpneiZEy9Rz",12,228068855347,3267,MACHINERY,ng dolphins cajole across the carefu
1081,Customer#000001081,eGGRjZex7YANvD1jfnPMcBK2JbM,12,228669421021,8647,MACHINERY,pendencies haggle after the quickly special instructions. furio
1082,Customer#000001082,vMX52A1zqDbGNzjfSzgsxSVU0GU6iFmrgiUE,5,156463842302,3248,BUILDING,"ly. blithely final packages wake silent ideas. express, special theodo"
1083,Customer#000001083,tnrpYmWGxwyaFmJy2Oq0Z,7,171594993318,3847,FURNITURE,luffily. slyly unusual accounts cajole furiously against the ironic asymptotes. slyly reg
1084,Customer#000001084,E091r836A8TPqn5,2,123788997136,1417,FURNITURE,nstructions. fluffily pending pinto beans affix slyly; carefully pending requ
1085,Customer#000001085,pZgtHRGIkUVwiEJLWZXs3KUNi6wLnQzJU1,21,318317023157,5276,BUILDING,he carefully regular courts use special excuses. ironic deposits along the blithely even sauternes nag slyly
1086,Customer#000001086,"ECMZrONto2nI2TBv,k",8,183994826815,9727,FURNITURE,ymptotes cajole enticingly furiously silent ideas. furiously pending packages are al
1087,Customer#000001087,ETOH68urIxK839xmKEmfkjc,21,313343916403,5878,MACHINERY,s haggle above the slyly express requests. quickly regular packages after the quickly silent accoun
1088,Customer#000001088,"YjXQtOJoM0nhClEy0,WFdNxvJ1g6xpn kL2ommEv",22,323242252635,2099,BUILDING,ly special ideas. slyly unusual requests haggle
1089,Customer#000001089,OO77  pLjaOe7bam1WnH9gtcZNCUlUPI,18,281647657462,3430,BUILDING,o beans affix carefully regular accounts. quickly even ideas sleep. pinto beans haggle fluffy courts. slyly regu
1090,Customer#000001090,P2JDHFVxjU,15,257119346343,5212,AUTOMOBILE,ffily even packages wake quickly
1091,Customer#000001091,"4ye7wJ3gU92RZCpwTtDi8Ws,",17,273369554882,0,BUILDING,y. carefully ironic excuses sleep quickly fluffily even requests. fi
1092,Customer#000001092,",oAq2L60hjb8",15,257661754580,2004,HOUSEHOLD,carefully silent somas can wake carefully aft
1093,Customer#000001093,"LO,9qCPIjSXriBqQsAOXLrQKedQ8UO6gb",24,349319116156,0,HOUSEHOLD,p furiously carefully bold packages. regular escapades breach. blithely unusual ideas integrate across t
1094,Customer#000001094,OFz0eedTmPmXk2 3XM9v9Mcp13NVC0PK,2,122347219871,2544,MACHINERY,"tes serve blithely quickly pending foxes. express, quick accounts"
1095,Customer#000001095,"JtyQvLlCI ZPYQ6ygv,5q",9,198812592391,6221,MACHINERY,"foxes. ironic, daring requests sleep regularly across the blithely"
1096,Customer#000001096,ldbo6AfnCRjFW8rZnvG6UxbX6o7ISAJRDD7,4,143688279896,3687,FURNITURE,"lyly even asymptotes cajole furiously. regular, ironic theodolite"
1097,Customer#000001097,a wMc0lQutcHs6cRomoMCGjvM0MwEk4uyrxKI3,6,166047585574,8652,MACHINERY,p carefully. carefully special excuses haggle carefully about th
1098,Customer#000001098,XVJb1HxQeLu9x,22,322067325183,1009,FURNITURE,evenly unusual deposits. slyly even ideas according
1099,Customer#000001099,2ZiU64au LN0 GUxY8,1,111281865241,8990,AUTOMOBILE,ckages: blithely ironic theodolites cajole furiously. f
1100,Customer#000001100,"PGXj,,vjAfMNLzd",12,228802067392,9190,BUILDING,ideas. furiously final sheaves integrate. pinto beans haggle slyly according to the furiously ironi
1101,Customer#000001101,"h,UOEyoi1ZG4",3,135284696051,0,MACHINERY,o beans; quickly express accounts slee
1102,Customer#000001102,F9fxZhJJhaR0P4Rgd7SE2PA58x,24,341033534822,2369,HOUSEHOLD,"elets. regular requests sleep quickly. express ideas haggle. bold, regular ideas haggle. quickly regular accoun"
1103,Customer#000001103,kbYrf d uR,16,263074238860,4878,AUTOMOBILE,n accounts cajole across the even pinto beans. quickly express pat
1104,Customer#000001104,",t,d8FlnmiECPa",8,186445078095,1230,AUTOMOBILE,ages haggle. slyly ironic foxes are idly among the furiously final pearls. slyly unusual reques
1105,Customer#000001105,"cZhhOUzv6,Vbaa2bFT",22,328852986750,9491,FURNITURE,y final packages. furiously ironic packages was. fluffily ironic instructions integrate
1106,Customer#000001106,WZEExIU9g2smcowcinj,21,312147392409,9978,HOUSEHOLD,requests nag. fluffily regular packages haggle q
1107,Customer#000001107,yQBP1SLK2uzN4dzgaQ,1,117208699052,7962,AUTOMOBILE,along the final deposits. carefully express ideas wake? quickly regular instructions are furious
1108,Customer#000001108,9sPt6a66R0eCRVYh9QrF8zjxNWFFk8KU,7,174084508891,4997,BUILDING,rding to the final instructions. carefully final accounts wake along the carefully careful pinto beans. re
1109,Customer#000001109,BJCfTYEV9eCDraeyO3v,22,321946971794,3387,FURNITURE,"r accounts. bold, final pinto beans wake carefully even Tiresias. quickly busy frays above the blithely ironic de"
1110,Customer#000001110,"BRnTy8RZ,1oHOg9ly8SsJLIyiuvhv",10,207772259349,2042,HOUSEHOLD,usual platelets along the quickly regul
1111,Customer#000001111,gavpg6eW5lEML,6,168243123537,2892,MACHINERY,s are slyly quiet requests. darin
1112,Customer#000001112,wFf 0nSvdJyk2GqRsqJrcr9 UPr0C3OT5zT,20,304014246458,9315,MACHINERY,fily quickly unusual theodolite
1113,Customer#000001113,jLtKZ0bRJyYL1k,12,224122161933,7392,HOUSEHOLD,ages among the furiously pending packages detect across the blithely unusual accounts. furiously ironic requests sh
1114,Customer#000001114,f7 he8eByBFy6z7vcOajC1gaUKqmRN,14,246309883843,6447,BUILDING,ularly ironic platelets. pinto beans along the slyly express packages wake unusual packa
1115,Customer#000001115,Elvb2a3FinAzxw,5,153561456356,0,BUILDING,ending instructions thrash blithel
1116,Customer#000001116,"aWuLgbu,8HZMbkI",14,241162144051,593,AUTOMOBILE,"tes-- final, regular excuses sleep. sly"
1117,Customer#000001117,80NfzBRWj5tUUaRdnsFE7Eg,23,334614395684,2829,FURNITURE,ironic deposits need to haggle furiously. furiously bold deposits use among the carefully ironic
1118,Customer#000001118,"QHg,DNvEVXaYoCdrywazjAJ",11,215837158627,4130,HOUSEHOLD,y regular requests above the blithely ironic accounts use slyly bold packages: regular pinto beans eat carefully spe
1119,Customer#000001119,ER5vABifV766q5f0FN7l2eN7MIg2lO,20,307897166850,3972,AUTOMOBILE,pinto beans maintain slyly even instructions. regular acc
1120,Customer#000001120,UAG90slCmJS7JOP AhlV12tYD3yUiyB1p2hxZ,2,129385797156,1544,AUTOMOBILE,r theodolites boost. slyly final pinto beans sleep blithely unusual accounts. fluffily even multipliers
1121,Customer#000001121,"o2uc3AHYz,m 3vYg8YxBwI0XuG",20,301979364724,3942,MACHINERY,usly? final theodolites are carefully
1122,Customer#000001122,"9lxNEW0Rei4DFaT4vX,T551AwBzrZoOXsRNOm",0,102579573327,45,BUILDING,"egular, regular instructions are slyly regular requests. deposits despite the regular, pendi"
1123,Customer#000001123,pO80QGjK7S0Kmoh46dViD K4OSEVDyiJ53CN,16,269831925480,9786,MACHINERY,s carefully ironic packages. accounts boost boldly fluffily even gifts. slyly final fo
1124,Customer#000001124,"EQNw9dNy63,",1,117095822006,5513,BUILDING,ctions wake. packages haggle furiously. express
1125,Customer#000001125,DrHkeaX6wshtuZOI2nLrME,3,138075423923,8428,MACHINERY,counts according to the carefully silent grouches haggl
1126,Customer#000001126,8J bzLWboPqySAWPgHrl4IK4roBvb,8,188989946389,3906,AUTOMOBILE,se carefully asymptotes. unusual accounts use slyly deposits; slyly regular pi
1127,Customer#000001127,nq1w3VhKie4I3ZquEIZuz1 5CWn,10,208308756204,8631,AUTOMOBILE,endencies. express instructions wake about th
1128,Customer#000001128,"72XUL0qb4,NLmfyrtzyJlR0eP",0,103922008982,8124,BUILDING,odolites according to the regular courts detect quickly furiously pending foxes? unusual theodolites use p
1129,Customer#000001129,"OMEqYv,hhyBAObDjIkoPL03BvuSRw02AuDPVoe",8,183135859420,6020,HOUSEHOLD,pades affix realms. pending courts haggle slowly fluffily final requests. quickly silent deposits are. iro
1130,Customer#000001130,60zzrBpFXjvHzyv0WObH3h8LhYbOaRID58e,22,325037218203,9519,HOUSEHOLD,s requests nag silently carefully special warhorses. special accounts hinder slyly. fluffily enticing
1131,Customer#000001131,KVAvB1lwuN qHWDDPNckenmRGULDFduxYRSBXv,20,306445409044,6019,MACHINERY,er the carefully dogged courts m
1132,Customer#000001132,6dcMOh60XVGcGYyEP,22,329534196880,4962,AUTOMOBILE,"ges. final, special requests nag carefully carefully bold deposits. ironic requests boost slyly through th"
1133,Customer#000001133,FfA0o cMP02Ylzxtmbq8DCOq,14,248587622348,5335,MACHINERY,"g to the pending, ironic pinto beans. furiously blithe packages are fina"
1134,Customer#000001134,79TYt94ty a,9,198329247391,8458,HOUSEHOLD,riously across the bold instructions. quickly
1135,Customer#000001135,"cONv9cxslXOefPzhUQbGnMeRNKL1x,m2zlVOj",11,215178523282,3062,FURNITURE,"regular frays about the bold, regular requests use quickly even pin"
1136,Customer#000001136,"GHCEiSK0TKsOncuJT3,2zSvlZW4Pz",24,344407981100,0,FURNITURE,ular pinto beans. slyly special deposits according to the slyly ironic requests maintain quickly
1137,Customer#000001137,LJ3J3i0BlPLrhKi6VabXxNrtpLAGH,16,265985651269,4210,AUTOMOBILE,usly quickly unusual attainments. stealthily unusual requests cajole ironic reques
1138,Customer#000001138,"8 9P,dIGWnrrDiVs0S",22,322368172959,6035,BUILDING,"instructions cajole thinly ironic requests. regular packages affix. ironic, final pinto beans ac"
1139,Customer#000001139,UDGG69rYgUGayNk 9vFytd5q3nZdeRZQNSfL6,22,321826629475,4605,BUILDING,y pending pinto beans haggle blit
1140,Customer#000001140,leG5nToZpjmWNeaOsVv,20,303317547359,6319,AUTOMOBILE,pinto beans. blithely regular packages sleep carefully blithely ironic requests. requests eat blithely aga
1141,Customer#000001141,A6uzuXpgRPp19ek8K8zd5O,22,323306189020,1,MACHINERY,accounts. furiously pending deposits cajole. c
1142,Customer#000001142,b7ytiiX7E9,16,261916828920,3273,AUTOMOBILE,doze slyly. furiously pending deposits cajole fluffily carefully pending packages. boldly regular
1143,Customer#000001143,9tfTGdYHyZXtXbbeboPIXwCT,4,145684719747,8656,AUTOMOBILE,e carefully final packages integrate against the furiously express platelets. ironic ideas wake above the e
1144,Customer#000001144,DGLUWG9evYLNbYhOXVzqZ LdfIMVfBjDf,1,113364534489,4189,BUILDING,"ideas. even, regular excuses after the ironic requests cajole blithe"
1145,Customer#000001145,"6R rPD6SDQPpFuYxxwh,Dv1PeusmP,C6cNcI",2,122707562968,3249,HOUSEHOLD,e. asymptotes sleep fluffily quiet requests. even theodolites among the fluffily regular pinto
1146,Customer#000001146,"DRBYvF0iBGsDC3iPNFsPHq3FkU,jCK8LJPX4W",12,227202371751,4204,FURNITURE,"final, pending asymptotes. regular requests was"
1147,Customer#000001147,AVjlczwVwL CT jO3sgWn,15,257548097107,7735,HOUSEHOLD,eposits. quickly express accounts are idly. slyly final platelets wak
1148,Customer#000001148,7PslyqtS1K2Pabjht 4qgaZ1BbSNFfz6QiK4K,19,293934452761,7130,AUTOMOBILE,"c, even deposits. accounts do use. regular accounts haggle blithely special, express courts. blithely"
1149,Customer#000001149,5JOAwCy8MD70TUZJDyxgEBMe,3,132542423889,6288,MACHINERY,ress requests haggle carefully across the fluffily regula
1150,Customer#000001150,fUJqzdkQg1,21,312366658430,0,MACHINERY,usly final dolphins. fluffily bold platelets sleep. slyly unusual attainments lo
1151,Customer#000001151,ratQBQ4rYv TfhWfHe,7,179481352667,6355,BUILDING,l requests. furiously bold orbits after the furiously ironic excuses sleep
1152,Customer#000001152,QRmFl9ZkoBDQ7,12,224713415516,5680,HOUSEHOLD,"oost along the quiet, bold foxes. ironic dinos nag fluffily final pinto beans. blithely regular deposit"
1153,Customer#000001153,"SYG3KMj1fMh7GwvIZ,pY7mGLR1NT6EmNjE",3,133194205160,6244,HOUSEHOLD,"s. even packages use fluffily always express packages. regular, even asymptotes about the furiou"
1154,Customer#000001154,7RqtNwcSPbaUKaC,19,297971326916,1498,BUILDING,thely. furiously regular accounts above the ironic platelets wake slyly blithely bold pint
1155,Customer#000001155,kEDBn1IQWyHyYjgGGs6FiXfm3,8,188649533058,3510,MACHINERY,ages? fluffily even accounts shall have to boost furiously alongside of the furiously pendin
1156,Customer#000001156,3ShFbt9dTbLOG4lUBvc1AZp0Tam0BNjYS qwTZ,14,246377241410,1800,HOUSEHOLD,ns. carefully regular foxes are quickly. furiously careful accounts accord
1157,Customer#000001157,3rchTZwilGpffMz1MfpnkFfWBtOIdgmvvS1E7sJj,20,307417949826,6013,HOUSEHOLD,equests. deposits cajole quickly slyly spe
1158,Customer#000001158,"btAl2dQdvNV9cEzTwVRloTb08sLYKDopV2cK,p",10,204877478857,3082,MACHINERY,theodolites use stealthy asymptotes. frets integrate even instructions. car
1159,Customer#000001159,IAnWq4YFKs7,2,122698073861,5554,HOUSEHOLD,ages sleep fluffily. packages after the carefully express packages nag slyl
1160,Customer#000001160,"v65g1aRCGA76ZHySoOBffL31n4vJ0nm,tK,UEA",24,341039424634,4976,AUTOMOBILE,"pending, special packages against the blithely unusual packages eat quic"
1161,Customer#000001161,QD7s2P6QpCC6g9t2aVzKg7y,19,292136633342,591,MACHINERY,ly alongside of the quickly blithe ideas. quickly ironic accounts haggle regul
1162,Customer#000001162,b5N12h9D6yJemoVx6OQf0uL,2,128871159986,3140,AUTOMOBILE,refully furious packages. furiously ironic ideas against the carefull
1163,Customer#000001163,54fBdElRYOjEH8S,2,122048031483,90,BUILDING,inments. carefully regular instructions haggle carefully slow packages. slyly even packages kindle blithely special
1164,Customer#000001164,XWfNRnO2S5KAW0VodNwaBDixCEtv nKzt2LVFiwm,0,108281785049,7341,HOUSEHOLD,ideas use. unusual packages sleep
1165,Customer#000001165,h7KTXGSqsn0,9,197664096769,8177,MACHINERY,"jole slyly beside the quickly final accounts. silent, even requests are stealthily ironic, re"
1166,Customer#000001166,W4FAGNPKcJFebzldtNp8SehhH3,17,278692237506,507,MACHINERY,before the platelets! carefully bold ideas lose carefully
1167,Customer#000001167,gNYGOcGkJu3ooSmsCh,19,297214791548,9511,FURNITURE,"lly regular ideas grow furiously regular accounts. regular, special requests sleep blithely. slyly bold pla"
1168,Customer#000001168,gmAnpwPPg0LX4,17,276088832632,6195,FURNITURE,ses run according to the regular instructions. slyly regular foxes around the furiously ironic theodolites use fl
1169,Customer#000001169,04YQNIYyRRFxUnJsTP36da,4,149751699356,7503,MACHINERY,into beans doubt about the slyly ironic multipliers. carefully regular requests breach theodolites. special packages
1170,Customer#000001170,BNhssVcV36vshEHUAc aPFJ,8,186706288499,2071,HOUSEHOLD,ronic instructions. express pinto beans poach blithely. quickly ironic accounts n
1171,Customer#000001171,GatOC LsLU9MkgyaNMYH,8,184573942863,7659,HOUSEHOLD,c dolphins. accounts are slyl
1172,Customer#000001172,"r dreL8m8cRaiIz IqZ83oMo,AVxe2PbsHQzK",14,242495881969,421,FURNITURE,"express asymptotes haggle furiously. fluffily special deposits haggle quietly even, special tithes. ironic foxes alo"
1173,Customer#000001173,6Abj72jR5Z0GYQMZKBmiQxW,18,284093656392,183,FURNITURE,ironic accounts above the ironic excuses haggle fluffily furiously regular packages-- slyly regular gi
