C_CUSTKEY,C_NAME,C_ADDRESS,C_NATIONKEY,C_PHONE,C_ACCTBAL,C_MKTSEGMENT,C_COMMENT
340,Customer#000000340,WRnPrKQmAmoMQgHQERoVOhyTklcHMajJlc,2,127306814571,4667,BUILDING,"es sleep according to the even, unusual Tiresias. carefully bold packages haggle. furiously pending s"
341,Customer#000000341,"4,zQfld2YV9TSeNgCSOvqlxhJvVW8WD",9,198708138585,8247,FURNITURE,"low, special platelets alongside of the even, bold theodolites are carefully"
342,Customer#000000342,SpDDdUfraEAfCULAuGLE,18,286901199571,7187,AUTOMOBILE,luffily final ideas. finally unusual requests boost slyly above the furio
343,Customer#000000343,ejvvSNHIkJVm8I1zpQINNn5yyJbA,3,138779105134,5521,HOUSEHOLD,unusual requests cajole blithely about the carefully express ideas. blithely even excuses above the pint
344,Customer#000000344,"Zasc8,E0VVY",2,128107886699,0,FURNITURE,le according to the regular instruction
345,Customer#000000345,"dGFK ICPKxnsAzlX4UYOUf,n200yyEWhIeG",9,192095764513,1937,AUTOMOBILE,en pinto beans nag along the slyly regular deposits. slyly ir
346,Customer#000000346,"K61SvIue3Emcwfel,7f9tO5WyJ58MbT7k3iS",2,121008904659,238,FURNITURE,ickly even pinto beans affix across the bravel
347,Customer#000000347,qRT7WRrnykLDfTc5Ei,1,115198329913,7349,BUILDING,ts use blithely blithely regular theodolites. even requests after the
348,Customer#000000348,ciP7BWkhOe1IbbVGlqJePBI6ZwqENkS,13,239861415327,3310,HOUSEHOLD,al foxes are on the carefully final excuses. careful dependen
349,Customer#000000349,"vjJBjxjW9uoRZP02nS p6XY5wU6Ic,6xHpxUKA",23,338182293473,0,BUILDING,"y. bold, ironic instructions after the theodolites sleep blithely ironic packages. ideas c"
350,Customer#000000350,G vBMGVmIOHl7tc4HeNMiMkKY,15,259608093690,19,BUILDING,tions. quietly unusual accounts sleep blithely afte
351,Customer#000000351,De35Hx1QiyS0uy,7,178734204342,3420,AUTOMOBILE,telets haggle blithely against the ironic
352,Customer#000000352,HqhIE5GRTK0dFtWpJUQENU4aa1bwdsUBEWtzUw,9,199061588420,6258,HOUSEHOLD,ts are. blithely special requests wake. furiously bold packages among the blithely eve
353,Customer#000000353,eftGCmL4b5rAKdvUe9biJXzAH,10,207336442244,3199,BUILDING,nal theodolites nag carefully. requests wake. slyly ironic ideas according to the blithely pe
354,Customer#000000354,sV3WgvJA06WngO4,2,125451012447,7096,BUILDING,". regular, final requests cajole fluffily. express attainments wake slyly until the even acco"
355,Customer#000000355,205r3Xg9ZWjPZNX1z,14,246567876091,8728,FURNITURE,ly bold requests detect furiously. unusual instructions sleep aft
356,Customer#000000356,9RfNXUJivKTonL2bp1eG5IT,10,204154574421,2934,FURNITURE,al packages haggle always. daringly bold inst
357,Customer#000000357,l2C0Xkdib4t4 qKFUcRDOhRQMK7U0,18,284529658560,8747,AUTOMOBILE,ress platelets cajole fluffily final accounts: slyly ironic foxes s
358,Customer#000000358,F  z jplpUKWz1Hn7p3ez2qTsiIh,5,154572553822,0,MACHINERY,e furiously pending requests. slyly bold requests wake deposits. furiously express
359,Customer#000000359,z4lUH9ssc3K2w0UjRIuNRrdqw,14,246085474751,6375,FURNITURE,ifts wake fluffily ironic ideas. slyly ironic deposits above the
360,Customer#000000360,"S,6ajyDFO3WUQ0Qr",17,276046461645,6543,FURNITURE,engage. quickly final platelets about the fluffily unusual accounts wake
361,Customer#000000361,l0F8jMJVe63cb,20,301642674590,7452,BUILDING,fully busy ideas. regular foxes cajole
362,Customer#000000362,UscV00TNrNTDddxF7BTk,17,276516534122,6149,AUTOMOBILE,ut the fluffily ironic platelets. ironi
363,Customer#000000363,2Koh mYARhsVcFn0U2Abt35qIyedAr1TxP,17,274605293937,0,HOUSEHOLD,s. carefully unusual deposits are foxes. furiously even foxes nag carefully according to the furiously express
364,Customer#000000364,"SQ3b5Q5OtrmmZjJ87tq,o1TiXKVJQ0M7ZOuud",23,334926474972,32,HOUSEHOLD,dependencies? pending requests use carefull
365,Customer#000000365,QiZRz y1xU,24,347086965226,737,HOUSEHOLD,counts. unusual packages are blithely foxes. unusual dinos
366,Customer#000000366,pPQektSfn55AC7s9SRFkj07I2yXqakvCa,3,139155316826,0,MACHINERY,"nos wake quickly. regular, regula"
367,Customer#000000367,yZaDoEZCqt2VMTVKoZUkf6gJ4yj,13,239393194691,9109,HOUSEHOLD,"eodolites under the ironic, stealthy requests affix furiously among the unusual tit"
368,Customer#000000368,9p ReFA4fseKWYUaUHi,22,325525964994,85,MACHINERY,ic asymptotes. quickly special packages along the bravely bold depos
369,Customer#000000369,"ge1XhgI3ADIkvLr5GPMqpup,hzlTVv",8,183336449832,2881,FURNITURE,theodolites? quickly quick foxes are fluffily slyly regular instructions. fluffily
370,Customer#000000370,oyAPndV IN,12,225242808721,8983,FURNITURE,ges. final packages haggle quickly. slyly bold
371,Customer#000000371,dnxjCYwhuSHx 9KX38nV0R16fG,22,321193462028,7789,AUTOMOBILE,"equests shall boost furiously special pinto beans. express, ironic ideas sleep across the ironi"
372,Customer#000000372,aKPMNZfbgV0neVIBo,19,292263396392,0,MACHINERY,. furiously even foxes sleep at the forges. bold accounts sleep after the ironic theodolites. ironi
373,Customer#000000373,"2hrQ wHkbaNlJCzY,mVkugMIE 8ryNlaA3JHDTjJ",20,308831704010,2354,MACHINERY,requests wake blithely even packages. slyly ironic deposits haggle blithely
374,Customer#000000374,"fg4eklU1,UaFOan",22,322827233627,6719,AUTOMOBILE,ges are carefully. slyly ironic deposits about the fin
375,Customer#000000375,e53JADEeGvM1ikhN7aa,15,255752739756,5562,HOUSEHOLD,st the pending accounts. final courts above the pending pinto beans use furiously ironic requests. dolphins
376,Customer#000000376,4NwsvFQU T4mSgzvU1Rx2ZtHOGyaNyhe,16,264379528986,4231,AUTOMOBILE,gs cajole quickly. bold asymptotes wake regularly along the quickly
377,Customer#000000377,"PA4levhyD,Rvr0JHQ4QNOqJ9gW YXE",23,332606104079,1044,MACHINERY,. slyly regular ideas cajole blithely. slyly ironic foxes are carefully after the thinly special accou
378,Customer#000000378,"133stqM9 LT,a2BSlbm49 nXreFggaZgW6P6J",22,321477934825,5718,BUILDING,ackages haggle fluffily ironic packages.
379,Customer#000000379,"t3QzCf,q1NbshmjOIUY",7,172285509246,5348,AUTOMOBILE,"l deposits cajole blithely blithely final deposits. express, even foxes grow carefully about the sile"
380,Customer#000000380,n2w3Jd1bipwICbOVgrELzcNRexmWSklo,21,315384934229,2755,BUILDING,riously special accounts. slyly final accounts sleep; blithely special requests integrate carefully slyly en
381,Customer#000000381,w3zVseYDbjBbzLld,5,158602087093,9932,BUILDING,"t regular, bold accounts. carefully quick packages haggle. care"
382,Customer#000000382,"UdgAMamK5JnSykA,ZPfR5W5zRFatDUye",8,189426506657,6269,AUTOMOBILE,. blithely express notornis according to the blithely even requests are never fina
383,Customer#000000383,iBIHYgXvVDpu6qq7FlqXVcAIDAzv4qs,2,128689209034,0,MACHINERY,slyly express ideas haggle blithely unusual dugouts. ironic pinto beans are ironic ideas.
384,Customer#000000384,kDDMb3ML nUSu2Sn7CUHyZVedAFUx9,9,192714538361,0,HOUSEHOLD,"olites. express, unusual dolphins cajole carefully about the"
385,Customer#000000385,zJvPI24TSPpiFzYfu3RvTKQ9,3,137416756890,2457,AUTOMOBILE,rs. blithely ironic deposits nag furiously across the furiously ironic accounts. bold deposits sleep express
386,Customer#000000386,DeQxsCxixT8RQ7JV6mddRYGDGQ2WM94,24,341931431425,232,BUILDING,"counts. blithely permanent deposits wake slyly! unusual, even theodolites u"
387,Customer#000000387,Yj 9g1mNu00rKRkc1ovOmptsPI,18,286943633673,3404,HOUSEHOLD,oach. blithely regular instructions sublate across the quickly regular ideas. qui
388,Customer#000000388,dV4lqEufXkF8R,7,178568146352,1938,HOUSEHOLD,carefully bold deposits: final pinto beans sleep slyly idl
389,Customer#000000389,"ij8KNM0,HRvIvnvY w8jQK4zvr1EOO9YM",9,192649431253,0,AUTOMOBILE,o beans affix fluffily. slyly ironic notornis wake
390,Customer#000000390,"Nsc3VZZnVsw0mLAnqqzVz,",4,148122536693,8862,HOUSEHOLD,final packages promise quickly. pending theodolites haggle quickly above the doggedly ironic
391,Customer#000000391,q10SV05KB1038lzUR8P,11,216044514462,4801,HOUSEHOLD,le blithely final forges. furiously even deposits cajole fluffily even patterns. furious
392,Customer#000000392,H7M6JObndO,17,276017932507,8492,BUILDING,efully bold ideas. bold requests sleep carefully blithe instructions. carefully final accounts are blithely quickly
393,Customer#000000393,RSELskV44I3LFA9VLGY2Qe,20,307499495915,3594,FURNITURE,ake furiously express notornis. pending accounts hang slyly slyly blithe theod
394,Customer#000000394,"nxW1jt,MQvImdr z72gAt1bslnfEipCh,bKZN",23,334226006936,5201,MACHINERY,instructions. carefully special ideas after the fluffily unusual r
395,Customer#000000395,b06rg6Cl5W,15,258043886600,4582,HOUSEHOLD,s mold blithely regular platelets. slyly silent instructions use slowly slyly specia
396,Customer#000000396,miE7JrCdGpQkF4zYJ27tBdSu IYhQ HXx0,22,329029364845,1434,BUILDING,xcuses. regular pains wake slyly across the ruthlessly ironic dependencies. e
397,Customer#000000397,EzR2BKJ85SmBDS,7,171033578777,709,FURNITURE,"al theodolites. regular accounts are regular, silent foxes. unusual asymptotes above t"
398,Customer#000000398,cq9NmtIT4b6JB8L79iLzljlHs4 3,15,251102153747,8866,HOUSEHOLD,l deposits breach slyly ironic asymptotes. carefully pend
399,Customer#000000399,ZBvzMa6N1wdCGaPmG13xVusIxdjSiA94jTXN,8,188826645454,7359,BUILDING,yly even excuses. ironic theodolites wake furiously. blithely regular pinto beans cajole. fin
400,Customer#000000400,U23zy17EPxqmJn7neVc,14,245227461247,0,BUILDING,fully bold accounts cajole bravel
401,Customer#000000401,"aKALIG526OK4veQfUh2KmKcE,oRyg",19,296677665291,4146,BUILDING,l instructions wake. slyly express deposits us
402,Customer#000000402,"8Cw4p1m1gKYVUgomkAq,es1ZtrnmHaO",6,169507291638,2107,AUTOMOBILE,dolites. furiously regular theodolites integrate furiously. bravely bold requests are. furiously
403,Customer#000000403,"9,BVYegfkFLsEMDkeVW",14,247534331769,6693,HOUSEHOLD,al hockey players; ironic dependencies after t
404,Customer#000000404,2orgvLJ05jOvM292mhkS7iJmHG0jk,22,328407851776,7409,BUILDING,uickly brave requests haggle furiously carefully special idea
405,Customer#000000405,mCQNH1rJtqjjQ9Piauc2bZr4pRFydscZtbD9d,10,205093017901,7519,MACHINERY,"nts. pending, express foxes sleep? ironic, pending instructions haggle. ironic, pending theodolites detect slyly. bl"
406,Customer#000000406,j1fOG9WsIr2JI6Yi9jgJ M,9,194266934043,4287,FURNITURE,nal foxes. unusual pinto beans wake. special excuses cajole ironic
407,Customer#000000407,cfCP9bE3HnI,1,119754548499,9537,MACHINERY,ect among the carefully regular theodolites. regular dep
408,Customer#000000408,"TBjb3m,3aea4JtP833HD4VDk7STz2Y9FB",10,201778075661,6825,BUILDING,unts. furiously ironic depths among the instructions wake carefully along the blithely ironi
409,Customer#000000409,mtrMiDvQxNsy1Cj0cU4ITEW5wGKLPQ2IPHNE9r4,11,214664124731,3970,FURNITURE,"fily pending courts. express, regular packages are furiously along the quickly regular packages."
410,Customer#000000410,"nYak2u Q9,gYUiLfh1N",7,175763455940,4349,BUILDING,"sublate across the pending, express asymptotes. quickly"
411,Customer#000000411,"V3e,FX5x50scsQDzt5,ESxfOQBt4OzjHRoTZxF",18,284839241955,1209,HOUSEHOLD,refully. slyly even packages above the evenly regular asymptotes are blithely ironic dependencies. deposi
412,Customer#000000412,"5IN2Y,QrhDJ2YBVGKiDbMpzi2hk1fmozIy2zQ",22,329403183191,6044,BUILDING,ithely silent notornis haggle. regular requests haggle according to the ironic deposits. blithely final dep
413,Customer#000000413,",4Jm5N0ruhJCB7cBR6Kw",6,161582857336,5818,FURNITURE,ular packages integrate furiously fluffily final accounts. carefully regular
414,Customer#000000414,i49DWI61AFb 45vb1RMH,19,295523802475,528,AUTOMOBILE,"sily silent, even accounts. careful, final ideas boost fluffily. slyly final pinto be"
415,Customer#000000415,"334jCRiUb,gx3",23,333468762972,2318,FURNITURE,egular deposits. blithely ironic inst
416,Customer#000000416,fm7H7k6sYhKfXttOT,12,226511464780,4365,MACHINERY,p the pending pinto beans. furiously express reques
417,Customer#000000417,X3LMSpIn4FgjgJxldHVUlUvKzyX,11,217943645100,6188,BUILDING,lent multipliers. quickly express theodolites kindle blithely. ironic re
418,Customer#000000418,",e0q82drO rgVHXHrJRQ0GDrRoUOl",5,158265081218,1211,FURNITURE,d foxes against the furiously special packages snooze blithely quickly
419,Customer#000000419,gvbZNJ4UVBAo5yOZ2UOWcvV9TeTj,16,263384472399,7787,BUILDING,ideas affix alongside of the final accounts. quickly ironic deposits abo
420,Customer#000000420,HV0YB82MWw93 9K,20,307763665869,1999,BUILDING,"ideas wake. fluffily ironic packages hang furiously above the regular, even platelets; packages haggle slyly"
421,Customer#000000421,it3mUlkZAe9J8gmy,13,239182282560,7073,FURNITURE,lithely final deposits haggle furiously above the
422,Customer#000000422,AyNzZBvmIDo42JtjP9xzaK3pnvkh Qc0o08ssnvq,9,192992472444,0,HOUSEHOLD,eposits; furiously ironic packages accordi
423,Customer#000000423,Y2B EbOg39GpFLS0n,13,232015017824,96,BUILDING,"ts cajole after the silent, pending instructions. ironic, even asymptotes use carefully. furi"
424,Customer#000000424,"i4cf3kmRE9IJr,cu,1",19,298913116778,1866,HOUSEHOLD,"bove the express, final deposits wake furiously furiou"
425,Customer#000000425,lp3aCRBK11qFY,16,267564074828,5825,HOUSEHOLD,"ajole even, pending accounts. carefully brave accounts"
426,Customer#000000426,GjFjM4zjbyhNrV6XlE,19,297683306311,7818,HOUSEHOLD,ar instructions are against the ironic platelets. slyly final acc
427,Customer#000000427,LHzXa71U2AGqfbqj1yYYqw2MEXq99dWmY,2,121243093821,4377,MACHINERY,y even multipliers according to the regu
428,Customer#000000428,"TCVjlzbX7x,kWcHN33LRdEjO38mAGmPR",21,315875578211,1952,BUILDING,furiously quick accounts. slyly bold dependencies cajole carefully. quickly even requests int
429,Customer#000000429,"kZBtY,LQAFu4iaSagjfIk8Q8dzgmT",15,259899361954,9247,FURNITURE,ly regular requests haggle enticing excuses. carefully ironic requests on th
430,Customer#000000430,"s2yfPEGGOqHfgkVSs5Rs6 qh,SuVmR",3,134066114228,7905,BUILDING,ly slyly ironic attainments. slyly special instructions until the deposits nag quickly whithout the bo
431,Customer#000000431,RNfSXbUJkgUlBBPn,6,163269046643,2274,HOUSEHOLD,"e quickly. final, even excuses against the even accounts sleep agai"
432,Customer#000000432,FDConiq g20GI9dH QTM ZNX4OB9KU,23,333079129016,5716,BUILDING,"wake carefully close, special deposits. regu"
433,Customer#000000433,7XFuE4 euQR0w,20,306594453595,8746,FURNITURE,sual ideas affix carefully always regular accou
434,Customer#000000434,6LGAf2hv4MB5MJhfvNsg,3,133254431474,2940,MACHINERY,lly final Tiresias. blithely regular ideas nag stealthily about the furiously
435,Customer#000000435,diwjNQSb3wLYLy WfCDATo5rc1I3 s,2,127413096377,6217,MACHINERY,quickly excuses. blithely express theodolites poach slyly along the theodolites. slyly reg
436,Customer#000000436,4DCNzAT842cVYTcaUS94kR0QXHSRM5oco0D6Z,19,299276876390,5897,FURNITURE,olites engage carefully. slyly ironic asymptotes about the ironi
437,Customer#000000437,0PM1xuHd0q2ElcJp 77F2MykOVBSQnZR8u3jkn,4,143644928498,7761,AUTOMOBILE,foxes sleep across the slyly unusual pack
438,Customer#000000438,"eqo9A9oaE2CA7 7,L",23,333943884375,2131,MACHINERY,al deposits mold alongside of the fluffily brave requests.
439,Customer#000000439,3deBblz2syRv8yMf0yAVKkE4mDH20uDRj4tJVHUm,14,248733686801,0,BUILDING,ions may impress thinly for the deposits? even packages towa
440,Customer#000000440,"w4fKMgiBuGmV,nLn7NgJl1DoUWwNQMV8z  5,R",3,132444805751,1809,MACHINERY,even theodolites: fluffily final requests cajole about the quickly regular
441,Customer#000000441,gjYpcBx6MP8GvDa6,23,334383553491,9452,HOUSEHOLD,r requests wake theodolites. quickly final ideas haggle fluffily. blithely f
442,Customer#000000442,rvgayfJFLO2cjzMA,1,112405238711,4157,FURNITURE,"lets would affix fluffily. regular, regular ideas ought to haggle carefully blit"
443,Customer#000000443,UdyNGZ6GSz5aNpMO5N2,3,132411311632,3726,FURNITURE,"t the special, final platelets. bold req"
444,Customer#000000444,D8l4G8i9aZ7KRbqp6ajvR8h1wjr,1,114023001949,1505,HOUSEHOLD,express accounts along the pending deposits lose carefully above the furiously regular requests. pen
445,Customer#000000445,MX1UA0KUJzIGyWM p2hbLg5dCpVLws8KNcwEsP,20,308498466070,8019,FURNITURE,"e ironic, special accounts. quickly regular packages integrate fluffily slyly"
446,Customer#000000446,"mJOJwYfch izLCuw70,qhlJSmH",24,343211685681,9226,FURNITURE,ending instructions. boldly ironic foxes across the regularly ironic pains sleep along the carefully final deposits.
447,Customer#000000447,hVZBzP8Pii,3,134383447007,7666,HOUSEHOLD,telets around the furiously unusual foxes detect carefully against the
448,Customer#000000448,BH4vtnDpabk0NgoGNJWu4OUXnidfJ,24,349854226009,8117,BUILDING,"unts. final pinto beans boost carefully. furiously even foxes according to the express, regular pa"
449,Customer#000000449,DiUXazp8EYcJFsX2a7nciEpo9W5BRB4iqdb9HWL,4,148933816454,3002,MACHINERY,"posits boost slyly carefully regular requests. final, bold fo"
450,Customer#000000450,KVpuYa4dDW8lZZVBttyK614C2qdS,9,197823979006,5544,HOUSEHOLD,gular decoys nod slyly express requests. slyly bold theodolites are along the regular
451,Customer#000000451,"ZJKTC1Ck,B01fYZ xdN2",20,309392753248,2111,HOUSEHOLD,"quests grow furiously final deposits. ironic, even pi"
452,Customer#000000452,",TI7FdTc gCXUMi09qD",6,163359749174,6634,BUILDING,aggle quickly. unusual instructions i
453,Customer#000000453,"PZ4mmWL7R,El0MtLWMfLXp120lo0,itmO",8,182093818571,5678,HOUSEHOLD,"sts. slyly even dolphins across the bold, regular foxes haggle blithely"
454,Customer#000000454,d9oQCm3onNsFlIoteVjFcQDv,7,178189159400,6134,AUTOMOBILE,"ions print slyly platelets. carefully regular packages according to the fluffy, even foxes wake carefu"
455,Customer#000000455,"sssuscPJ,ZYQ8viO",6,168632259454,6860,BUILDING,"l wake. blithely final instructions integrate furiously above the final, regular req"
456,Customer#000000456,IgUSuulguDJ5,0,107849717777,8816,FURNITURE,ly even warhorses. quickly even requests wake slyly.
457,Customer#000000457,eaAWe Vqr0x17Uwj1uzQRb wQpXxZVDWS3Wg,20,305436842857,5868,FURNITURE,the foxes. carefully pending instructions integrate fluffily blithely pending packages. careful
458,Customer#000000458,iIKwI3HrgNlD9,4,146517064016,0,BUILDING,"ng. final, express requests are furious"
459,Customer#000000459,CkGH34iK 9vAHXeY7 wAQIzJa1cmA8DAEA7m,6,169276628584,1208,MACHINERY,"ronic, regular dependencies use above the ironic deposits. carefully express packages use car"
460,Customer#000000460,"Gbx5Hnw,ctlI7",11,216439556555,5223,FURNITURE,"old dependencies mold slyly above the foxes. dogged, express ins"
461,Customer#000000461,5vxNLzSASzkbrUr8CRf5,21,315332264307,9178,AUTOMOBILE,sits breach blithely. slyly regular ideas haggle fluffily; special ideas cajole q
462,Customer#000000462,MSqsCvNEkowp7FnscRXP6OUWm,21,311575614106,4523,HOUSEHOLD,ly special accounts? ideas engage regular dependencies. fluffily even pinto beans x-ray blith
463,Customer#000000463,"LV7MN7Tkm2NSo4Q3lwvjxGQyRJjRZRf,M",8,181672145805,0,HOUSEHOLD,quickly along the final ideas. slyly regular accounts are iro
464,Customer#000000464,"kAALP9gEt3,G9XtxCXjv38HjKBEP",9,192699719738,8731,AUTOMOBILE,efully express accounts play. special requests use carefully. regular courts sle
465,Customer#000000465,gngnTNn7azjgQlQJnakTZto,2,121378381346,8433,FURNITURE,es. quick asymptotes integrate carefully alongside of the ideas. even requests believe slyly even ac
466,Customer#000000466,"ZI1c8,ZanegEu5CEQxNf5,bkuYPwn7H7JIK7",12,222807383240,3168,MACHINERY,"foxes. express, ironic accounts boost? carefully silent deposits engage. accou"
467,Customer#000000467,amwRkh0nDQ6r6MU,11,214495815158,9399,MACHINERY,manently special warthogs. final ideas a
468,Customer#000000468,IcbihAtOVWcnswfyE,10,204899605023,9834,FURNITURE,"accounts cajole quickly above the blithely final packages. even, express package"
469,Customer#000000469,JWOULMa5Qtt,12,224069886460,6344,BUILDING,cajole carefully slyly regular packages.
470,Customer#000000470,v9 gWSuP4WrOjNJRgyJtjbNCChQME,20,305074584433,3598,HOUSEHOLD,ilent excuses. never ironic requests sleep furiously. daringly f
471,Customer#000000471,tGr0DtrK 91IgzfeZrSPpPIia3,4,145741181005,5717,FURNITURE,es. unusual accounts try to solve ca
472,Customer#000000472,hWgfnsmTAEOx9Mqp87YwztGrgLLqNkjMPh4,12,229404781933,7930,MACHINERY,deas sleep slyly blithely final foxes. slyly final e
473,Customer#000000473,zO3W9pYj PvlsQGe,9,192096475704,0,HOUSEHOLD,ter the quickly pending requests sleep above the carefully iron
474,Customer#000000474,"mvEKw,6zT0V8Yb2yTG hu990UX",21,312475366143,9165,MACHINERY,ns integrate against the quickly special courts. slyly
475,Customer#000000475,JJMbj6myLUzMlbUmg63hNtFv4pWL8nq,14,244854229361,9044,BUILDING,egular requests. ironic requests detect furiously; deposits ha
476,Customer#000000476,68r87HCBbQkVYaVfes8mgKs,2,129966289902,5973,BUILDING,"sly. carefully quick instructions sleep carefully deposits. final, pending pinto beans use closely fluffily final in"
477,Customer#000000477,5aW5WHphNgFdIS1Qdp2cIJXG8ER8,23,338458776997,1837,AUTOMOBILE,totes are blithely among the furiously final foxes. slyly
478,Customer#000000478,"clyq458DIkXXt4qLyHlbe,n JueoniF",1,116552912694,0,BUILDING,o the foxes. ironic requests sleep. c
479,Customer#000000479,RdIiG8NbwYtamReRwhR,18,283364061631,3654,AUTOMOBILE,ages. bravely even foxes detect careful
480,Customer#000000480,XyQSPswCeO WPD37K3 mYZ4hnCMJO5p,7,172311475851,2751,FURNITURE,posits. slyly ironic theodolites nag carefully about the quickly final accounts. s
481,Customer#000000481,"o4xa7J20NqHM8E0ykH,NKe1gPz04OqIn",21,313633926461,7157,FURNITURE,"s can nag slyly instructions. regular, regular asymptotes haggle sly"
482,Customer#000000482,389RgNCsmVUKiRskmrQQm90xx JiIxOM0,13,237324481610,4333,HOUSEHOLD,carefully bold instructions. carefully final instructions wake carefully accounts. accounts cajole slyly ironic acc
483,Customer#000000483,Yv1QV 1JsV 9sVbNufRvdnprt0grx52,11,217991891135,8877,MACHINERY,pecial ideas. furiously final i
484,Customer#000000484,ismzlUzrqRMRGWmCEUUjkBsi,20,307779538902,4245,BUILDING,"y against the express, even packages. blithely pending pearls haggle furiously above the fur"
485,Customer#000000485,"XeFbvXCQ,J",19,294349611623,8695,MACHINERY,ecial pinto beans. instructions ought to cajole even
486,Customer#000000486,2cXXa6MSx9CGU,21,317875348723,7487,AUTOMOBILE,"nstructions. unusual, special pinto beans sleep about the slyly pending requests. fu"
487,Customer#000000487,"oTc,l9dAf8O0qOOMP4P0WFTuGS",2,121114014259,9749,AUTOMOBILE,as. excuses use carefully carefully pending i
488,Customer#000000488,bBcMjFPTysSTaTdHcoO,3,135137781881,0,AUTOMOBILE,thely above the carefully ironic accounts. excuse
489,Customer#000000489,GIdW4IVgeqWMBXnNFZGHS8kmhw,4,149162416195,8256,AUTOMOBILE,lar accounts. finally pending dependencies solve fluffily
490,Customer#000000490,"66fG3Fyb946cVQsH9Z3VMNzR,yfHMKIEB",22,322681477824,0,FURNITURE,"ash carefully never bold instructions. regular, bold asymptotes cajole regularly. quickly bold foxes wak"
491,Customer#000000491,r3zPOuenxHl0oqInxWlEyLP1ZH,0,108562597548,785,AUTOMOBILE,"slyly special requests hang dogged, express epitaphs."
492,Customer#000000492,"JexAgMLuUHoElYFaKx,hJcAP1b1GknYoYHQLyx",8,186862441077,8635,AUTOMOBILE,gle furiously furiously final packages. carefully bold pinto beans promise quickly alongside of the close
493,Customer#000000493,G dRBjxmBBug1 xRSa6VwRchFDtU5b,16,265145587246,6582,MACHINERY,er the furiously express excuses use above the regular accounts. regular instructions after the
494,Customer#000000494,GKgTjHFlQrDZWcketSqhZCopBhmChknI,10,203304536579,6295,FURNITURE,"al courts. regular, ironic requests serve furiously. pending"
495,Customer#000000495,QhFbEv6KbQIwfZs 1krt1eACKI31v3iyM,7,174004056060,7998,BUILDING,dependencies. silent accounts cajole quickly furiously pendin
496,Customer#000000496,Y8oYLlHme6Z4fEzkTu,12,221736447922,8175,MACHINERY,quickly bold packages. decoys among the blithely pending accounts lose according to the deposits.
497,Customer#000000497,0 qRRXAxUbo1J KDwDMjFde5fXDwn,23,339377243506,2192,BUILDING,fluffy ideas detect carefully
498,Customer#000000498,"1Wnja9i7KAC3HxS5yATK,In8Q6AHcEUr0f5Tp",19,292108101479,3946,BUILDING,yly pending requests according to the slyly special asymptotes sleep carefully against the slyly even pack
499,Customer#000000499,m1hO3VXQVbwTbJ99Hw,14,243878179149,4294,HOUSEHOLD,old sentiments cajole carefully among the blithely unusual requests. final packages nag careful
500,Customer#000000500,fy7qx5fHLhcbFL93duj9,4,141947364233,3301,AUTOMOBILE,s boost furiously. slyly special deposits sleep quickly above the furiously i
501,Customer#000000501,"lzkYA5C6wa,wX",13,238676721331,1909,FURNITURE,ual deposits wake. quickly ironic platelets along the careful deposits haggle
502,Customer#000000502,nouAF6kednGsWEhQYyVpSnnPt,11,214055909919,1379,HOUSEHOLD,"even asymptotes haggle. final, unusual theodolites haggle. carefully bo"
503,Customer#000000503,"7xCLYGLCpFU,toJBIPIrJbLIuLok81h IxK ae5Z",20,304417553094,3214,MACHINERY,even deposits haggle. packages i
504,Customer#000000504,"2GuRx4pOLEQWU7fJOa, DYiK8IuMsXRLO5D 0",10,209162647594,1,FURNITURE,slyly final theodolites are across the carefully
505,Customer#000000505,"MAUkwAyEvg61RlCMomspMs0WzYa,Ns",2,125306478313,6558,HOUSEHOLD,mptotes haggle around the theodolites. furiously bold accounts detect quickly packages. special pinto beans
506,Customer#000000506,dT kFaJww1B,13,238957818227,1180,HOUSEHOLD,idle instructions impress blithely along the carefully unusual notornis. furiously even packages
507,Customer#000000507,"QlA0Fc 6e,r67ugESzq",14,241581854455,5727,MACHINERY,nst the furiously even deposits cajole slyly among the furiously ironic requests. blithely unusual depo
